{
    "input_image_check": "https://files.catbox.moe/z6mdko.png",
    "positive_prompt": "[Try On], The image pair highlights a transformation from a clothing sample photo to the effect of actually wearing it. ; [CLOTH_IMAGE]; [MODEL_IMAGE];",
    "seed": 0,
    "steps": 40,
    "guidance": 3.5,
    "sampler_name": "euler",
    "scheduler": "simple",
    "max_shift": 1.15,
    "base_shift": 0.50,
    "patch_mode": "auto",
    "output_length": 1536,
    "patch_color": "#FF0000",
    "custom_lora1_url": "https://huggingface.co/camenduru/FLUX.1-dev/resolve/main/xlabs_flux_realism_lora_comfui.safetensors",
    "custom_lora1_strength_model": 1.0,
    "custom_lora1_strength_clip": 1.0,
    "custom_lora2_url": "https://huggingface.co/camenduru/FLUX.1-dev/resolve/main/IC_TRY_ON_v3_e4.safetensors",
    "custom_lora2_strength_model": 0.9,
    "custom_lora2_strength_clip": 0.9
}